{
  "schema_version": 1,
  "artifact_type": "tool_telemetry",
  "case_id": "c-approval",
  "version": "new",
  "telemetry_mode": null,
  "contract_required": false,
  "contract_reasons": [],
  "event_count": 1,
  "tool_call_count": 0,
  "tool_result_count": 0,
  "final_output_event_present": true,
  "status": "ok",
  "issues": [],
  "tool_calls": [],
  "tool_results": []
}